<?xml version="1.0" encoding="UTF-8"?><Credential xmlns="http://www.zurich.ibm.com/security/idemix" xmlns:xs="http://www.w3.org/2001/XMLSchema" xmlns:xsi="http://www.w3.org/2001/XMLSchema-instance" xsi:schemaLocation="http://www.zurich.ibm.com/security/idemix ../xsd/Credential.xsd">
  <References>
    <IssuerPublicKey>http://www.issuer.com/ipk.xml</IssuerPublicKey>
    <CredentialStructure>http://www.ngo.org/CredStruct1b.xml</CredentialStructure>
  </References>
  <Attributes>
    <Attribute name="attr1">
      <Value>1313</Value>
    </Attribute>
    <Attribute name="attr2">
      <Value>1314</Value>
    </Attribute>
    <Attribute name="attr3">
      <Value>1315</Value>
    </Attribute>
    <Attribute name="attr4">
      <Value>4243</Value>
    </Attribute>
  </Attributes>
  <Signature>
    <A>38547885244920408785316177865629434199365967665496159822167562362705158812565467840098716303563206424452956037679549092895646124822196667516031538122413463188187237751148452743625031889263143909916968571194593125477112301398826290727643747133439251267729254167274540569453407612727207280897936437260509766964</A>
    <e>259344723055062059907025491480697571938277889515152306249728583105665800713306759149981690559193987143031743958363312210535470354979367218132856546485268278382025045733377278057489</e>
    <v>2086209402480643388505245372123173425252975461480642729527099994670633243771451107501447203184297355401858531972751239800919756320151124884464156191757262460584267827223872134858261701184565115148684891409168388374747172315932824546325024385675342040268231977956527253037244576750856402465980178255119378262931027437646200147986757090791162689374644613025667446387072006422498338165911474662114109966877586485632489131183566965975</v>
  </Signature>
  <Features/>
</Credential>