<?xml version="1.0" encoding="UTF-8"?><Credential xmlns="http://www.zurich.ibm.com/security/idemix" xmlns:xs="http://www.w3.org/2001/XMLSchema" xmlns:xsi="http://www.w3.org/2001/XMLSchema-instance" xsi:schemaLocation="http://www.zurich.ibm.com/security/idemix ../xsd/Credential.xsd">
  <References>
    <IssuerPublicKey>http://www.issuer.com/ipk.xml</IssuerPublicKey>
    <CredentialStructure>http://www.ngo.org/CredStruct6.xml</CredentialStructure>
  </References>
  <Attributes>
    <Attribute name="primeEncoding1">
      <Value>20550799</Value>
      <EnumValue>officialLanguage;Italian</EnumValue>
      <EnumValue>civilStatus;Common-lawPartner</EnumValue>
      <EnumValue>officialLanguage;Rhaeto-Romanic</EnumValue>
      <EnumValue>sex;Male</EnumValue>
      <EnumValue>officialLanguage;German</EnumValue>
    </Attribute>
    <Attribute name="primeEncoding2">
      <Commitment>
        <commitment>118501625669290620506257060871879848651914846327174328280772687909272285486118557565016573443708684374218341774042099888917406065751116158571245576170977428482669179847464185106623690142724878609071216964597717303926484481384537950402339890577313414822502962049297124471980414293618777189371496522786671560466</commitment>
        <S>67254978546586387746371812310799963199648525605698331029534251596232370027172664240407979301953626203319151762261652600759005672320154674443879786091477200196732310064009956256955600787213240490631750504640542741919004918195148381937131971214494976707809949834888578482370086318215794644835662415992756882603</S>
        <n>119044022186753690018430516777857594963368506134570973357311270757022475907431866561996530390008551579472891604827125833721397252053305134571142913793132219807152566643909997919585593336578843205692900329154693554897764568744373060642870170977183333982530812867790710426944978612698155788787287562342569509073</n>
        <Bases num="1">
          <Base>32921814524377017041931913576584439560632569931404502353475383371878236583978512140794089573553532245705459408417869416443659319693175867098884370978448886092451288399260225788087061330501562228689833809787781336214456117869525090072024003349054898349464658701210662766987336518999452802422749574128824579840</Base>
        </Bases>
        <CommitmentOpening>
          <Messages>
            <Message>129271155</Message>
          </Messages>
          <rand>27817636250359651442715077898297770061646860588881948544628239302822282187846411513973609862987452473391708176154253593642846938073399782545028943905842645069516856265737473458916499521562017851595595463519873060463927271077089691960121403939001747219602610681807829624417189734782374041440767263795177074423</rand>
        </CommitmentOpening>
      </Commitment>
      <EnumValue>driverCategory;D1E</EnumValue>
      <EnumValue>driverCategory;C1</EnumValue>
      <EnumValue>driverCategory;D1</EnumValue>
      <EnumValue>driverCategory;B</EnumValue>
      <EnumValue>driverCategory;A1</EnumValue>
      <EnumValue>driverCategory;C1E</EnumValue>
      <EnumValue>driverCategory;BE</EnumValue>
    </Attribute>
  </Attributes>
  <Signature>
    <A>78175799822632960818606191482908262158553650952983663832584326422725392623257850564434653701840437837183024873654878894243476147004368122865093811817079043763263618247295969282036432884313976812172565704932512049243968717493652080040719910167919954369849223714934908562211271713112852999633930312854381122885</A>
    <e>259344723055062059907025491480697571938277889515152306249728583105665800713306759149981690559193987143041911644143230013088949509839870267458761015589979911811377597076958298141849</e>
    <v>3255075302850792558971335976168645687888872024035996138736526957509336099258349827965650268140528083384127053476594390261160872125403858413746378864806399740420418071616084449581806800255404529472888275516734726265106234203864482834439988152609445956161767205784076187174806361842890849725647496365712027253809260862142524782586009638757437615792512837413711901900186424686574523672702665639631452102325924261177519817931181885667</v>
  </Signature>
  <Features/>
</Credential>