<?xml version="1.0" encoding="UTF-8"?><Credential xmlns="http://www.zurich.ibm.com/security/idemix" xmlns:xs="http://www.w3.org/2001/XMLSchema" xmlns:xsi="http://www.w3.org/2001/XMLSchema-instance" xsi:schemaLocation="http://www.zurich.ibm.com/security/idemix ../xsd/Credential.xsd">
  <References>
    <IssuerPublicKey>http://www.ch.ch/identityCard/v2012/ipk.xml</IssuerPublicKey>
    <CredentialStructure>http://www.ch.ch/identityCard/v2012/CredStructComplete.xml</CredentialStructure>
  </References>
  <Attributes>
    <Attribute name="FirstName">
      <Value>-688801371937649959579820756394775575840715893149737780334536265877869334605</Value>
    </Attribute>
    <Attribute name="LastName">
      <Value>-21845598845916938605275525313893548943236279141879078706962526334797938325724</Value>
    </Attribute>
    <Attribute name="SocialSecurityNumber">
      <Value>1313</Value>
    </Attribute>
    <Attribute name="BirthDate">
      <Value>1314</Value>
    </Attribute>
    <Attribute name="Diet">
      <Commitment>
        <commitment>96664811441283025187676609642640575030759019480955012035645059201138521431449916741676451269794150318901390447514841033667607151994105229511166872605803633036206918252472517547667094562205780633535535804208894030043915018047205477365868663999316586121305252276364090168910502691262150266791536012760683319379</commitment>
        <S>67254978546586387746371812310799963199648525605698331029534251596232370027172664240407979301953626203319151762261652600759005672320154674443879786091477200196732310064009956256955600787213240490631750504640542741919004918195148381937131971214494976707809949834888578482370086318215794644835662415992756882603</S>
        <n>119044022186753690018430516777857594963368506134570973357311270757022475907431866561996530390008551579472891604827125833721397252053305134571142913793132219807152566643909997919585593336578843205692900329154693554897764568744373060642870170977183333982530812867790710426944978612698155788787287562342569509073</n>
        <Bases num="1">
          <Base>32921814524377017041931913576584439560632569931404502353475383371878236583978512140794089573553532245705459408417869416443659319693175867098884370978448886092451288399260225788087061330501562228689833809787781336214456117869525090072024003349054898349464658701210662766987336518999452802422749574128824579840</Base>
        </Bases>
        <CommitmentOpening>
          <Messages>
            <Message>-27504312941977732075957586170872727553942019300228568380937261894832069870739</Message>
          </Messages>
          <rand>2944447706759055407566015056190404238540416281568439471108296937010069218751737405869656896516211134372921130281104843630650926261346802744627996307532320989896010483125021613920166264677434688374665447324274367946325008434885228509735191471971337078856504678594060488137157330955569549860201117815296742588</rand>
        </CommitmentOpening>
      </Commitment>
    </Attribute>
    <Attribute name="Epoch">
      <Value>3185</Value>
    </Attribute>
    <Attribute name="PrimeEncoding1">
      <Value>17917</Value>
      <EnumValue>OfficialLanguage;German</EnumValue>
      <EnumValue>CivilStatus;Common-lawPartner</EnumValue>
      <EnumValue>Gender;Male</EnumValue>
    </Attribute>
    <Attribute name="PrimeEncoding2">
      <Commitment>
        <commitment>118661833384529302930958718921627037754202876780291281939182913540890026002742427410226434254046242155055787689157200537794460840172537616441721944948333290807497709175702679841843586211696987324300251000816000948874833279294090200204465178432670167792304018578505914198402893729111847307212879838679108440706</commitment>
        <S>67254978546586387746371812310799963199648525605698331029534251596232370027172664240407979301953626203319151762261652600759005672320154674443879786091477200196732310064009956256955600787213240490631750504640542741919004918195148381937131971214494976707809949834888578482370086318215794644835662415992756882603</S>
        <n>119044022186753690018430516777857594963368506134570973357311270757022475907431866561996530390008551579472891604827125833721397252053305134571142913793132219807152566643909997919585593336578843205692900329154693554897764568744373060642870170977183333982530812867790710426944978612698155788787287562342569509073</n>
        <Bases num="1">
          <Base>32921814524377017041931913576584439560632569931404502353475383371878236583978512140794089573553532245705459408417869416443659319693175867098884370978448886092451288399260225788087061330501562228689833809787781336214456117869525090072024003349054898349464658701210662766987336518999452802422749574128824579840</Base>
        </Bases>
        <CommitmentOpening>
          <Messages>
            <Message>701054585</Message>
          </Messages>
          <rand>8652629355378491624613937029832254292005409940991589696331853967293952031133548481368865013689035004018063939131612098700150740137560588549501967550991782276188778415569106524849726117596602570852309332544662931697657425637389210449093398920686228346726253292494704019259301441303929410537658968747877355570</rand>
        </CommitmentOpening>
      </Commitment>
      <EnumValue>DriverCategory;F</EnumValue>
      <EnumValue>DriverCategory;B1</EnumValue>
      <EnumValue>DriverCategory;G</EnumValue>
      <EnumValue>DriverCategory;M</EnumValue>
      <EnumValue>DriverCategory;B</EnumValue>
      <EnumValue>DriverCategory;C</EnumValue>
      <EnumValue>DriverCategory;D</EnumValue>
    </Attribute>
  </Attributes>
  <Signature>
    <A>8078538325901340852381841532453288818658805679421367925551600197460225767033557589365460380012958848253520814995974526358781258550655783367918177436547300337086661507032282440627681354217413380772189578805708330064808194851797098137968525997218617265216449004535265992073622299774018412672179014886206889660</A>
    <e>259344723055062059907025491480697571938277889515152306249728583105665800713306759149981690559193987143081559857308200741484184131430688452505339959514830127850553220350087939062947</e>
    <v>2218912854148810264456598746976110124583217641671696445951441753390942817136344102198225032621684179914931962439962844541574518510159837300987888492694960343863894537518942747578029270685732154561117143514083255933488140196353194879459236419113564151823328587554375670580376964641959491761807347647388783883898383707241973544774302292000536518465054774508405691161588254296801894867694491070468090992546940464178062674036631482056</v>
  </Signature>
  <Features>
    <Updates>
      <UpdateSpecification>http://www.base.of.uri/where/the/updates/will/be/Update_r61umup0q7phhqc9vps.xml</UpdateSpecification>
      <capU>98351979528710957753507469530105885546554703788955714136232836214696034531872335469777032944631818336788697926121709664661376772880879487020241926933830155503201147043826823077976833430117107610499809622483603804401181587288372512326216345275086688318959337422136441240031078133537844487102245120112762270702</capU>
      <vPrime>458564961355590357487296381333320966302462853410710471835219414263463441534862878040643953598932779195343020404424802101476114494049061873143986827762750894634299161002810943874956218814392486457415021454423170022618284897292672690282118452519411235583978353675199791780403864065997387670434319293527277586057285074917782684789932</vPrime>
      <nonce>1101766145695401681539</nonce>
      <context>57132007859431325469155257180381990227612921134850039113478974728701260469495</context>
    </Updates>
  </Features>
</Credential>