<?xml version="1.0" encoding="UTF-8" standalone="no"?>
<Credential xmlns="http://www.zurich.ibm.com/security/idemix" xmlns:xs="http://www.w3.org/2001/XMLSchema" xmlns:xsi="http://www.w3.org/2001/XMLSchema-instance" xsi:schemaLocation="http://www.zurich.ibm.com/security/idemix ../xsd/Credential.xsd">
  <References>
    <IssuerPublicKey>http://www.issuer.com/ipk.xml</IssuerPublicKey>
    <CredentialStructure>http://www.ngo.org/CredStruct0.xml</CredentialStructure>
  </References>
  <Attributes/>
  <Signature>
    <A>21397845173032322715316801857580527660525153118887156537686888836670052750511347181937085496857762535091872366938631126944680978666173717760682752416257484052645265872895662285876494806327307780024781464567685948404719381827936069015123847634453227907084793616951390602215721319879411494096395138010534092755</A>
    <e>259344723055062059907025491480697571938277889515152306249728583105665800713306759149981690559193987143046676326919481317594417490678113170143315256239006926475310450001483072307279</e>
    <v>2059229659712534633327076997714248185756791674572990540821479274021565608509026222539620467702385543364304990762431040546918335476034137190242968355463379967425369784382295173671401097868734126280961700656872913628340089061116571620435985132827078559170377688788611634397901428421782782743831221049627028055193737568885829028948473617502640721674252848477428346067698402440964781210515757541342598610386673175658258644922556170875</v>
  </Signature>
  <Features/>
</Credential>
