<?xml version="1.0" encoding="UTF-8"?><Credential xmlns="http://www.zurich.ibm.com/security/idemix" xmlns:xs="http://www.w3.org/2001/XMLSchema" xmlns:xsi="http://www.w3.org/2001/XMLSchema-instance" xsi:schemaLocation="http://www.zurich.ibm.com/security/idemix ../xsd/Credential.xsd">
  <References>
    <IssuerPublicKey>http://www.issuer.com/ipk.xml</IssuerPublicKey>
    <CredentialStructure>http://www.ngo.org/CredStruct3.xml</CredentialStructure>
  </References>
  <Attributes>
    <Attribute name="attr1">
      <Value>1313</Value>
    </Attribute>
    <Attribute name="attr2">
      <Value>1315</Value>
    </Attribute>
    <Attribute name="attr3">
      <Commitment>
        <commitment>109662950371899881719023623576111417062995685578512576240355277756031173397453361032757612466931478435486484028560280181158999850937219043857826539869141831998252939026291125391056204317543307276757887742535357645332697302685543557897128308391743713111011714672140871232626567025539769872464194834455102969888</commitment>
        <S>67254978546586387746371812310799963199648525605698331029534251596232370027172664240407979301953626203319151762261652600759005672320154674443879786091477200196732310064009956256955600787213240490631750504640542741919004918195148381937131971214494976707809949834888578482370086318215794644835662415992756882603</S>
        <n>119044022186753690018430516777857594963368506134570973357311270757022475907431866561996530390008551579472891604827125833721397252053305134571142913793132219807152566643909997919585593336578843205692900329154693554897764568744373060642870170977183333982530812867790710426944978612698155788787287562342569509073</n>
        <Bases num="1">
          <Base>32921814524377017041931913576584439560632569931404502353475383371878236583978512140794089573553532245705459408417869416443659319693175867098884370978448886092451288399260225788087061330501562228689833809787781336214456117869525090072024003349054898349464658701210662766987336518999452802422749574128824579840</Base>
        </Bases>
        <CommitmentOpening>
          <Messages>
            <Message>1318</Message>
          </Messages>
          <rand>15855610395663705894320940319993853988065547656763879141421570854170817569596417828782399686351025645478304041100597684093593873611384503570394799056721212039519876935186226334611461384873179099176656004546040717330599010169469876859914098155541780401614200734327798683682595298794131659394529735259868785879</rand>
        </CommitmentOpening>
      </Commitment>
    </Attribute>
  </Attributes>
  <Signature>
    <A>24796957393598574770958651336527416245511376175201752026652177705086191010275496512275029198207260216521152377580876201185813216049769769985586032689962727798335351036752529545731717606845822233948468675643673154195569145259591696079059770126215157306420085035914897984510109581331354648616141815166704658744</A>
    <e>259344723055062059907025491480697571938277889515152306249728583105665800713306759149981690559193987143085885780205174975926193169051176876576082199061907986223344387012111457124513</e>
    <v>2268747689816799471088627480127415687632049080350222288059651231536862697848712889718841433249101701856460303162369206042728458054252343552069615785278581996855635626966268471111939365634209451835300021339396769838320154469577487605714460440052200626188850792150758017415934465514959981038805768591044389710794879098118905599523885315649174844491696427215703996102771393256483365274069193411086581815761289964796330600360007422622</v>
  </Signature>
  <Features/>
</Credential>