<?xml version="1.0" encoding="UTF-8"?><Credential xmlns="http://www.zurich.ibm.com/security/idemix" xmlns:xs="http://www.w3.org/2001/XMLSchema" xmlns:xsi="http://www.w3.org/2001/XMLSchema-instance" xsi:schemaLocation="http://www.zurich.ibm.com/security/idemix ../xsd/Credential.xsd">
  <References>
    <IssuerPublicKey>http://www.issuer.com/ipk.xml</IssuerPublicKey>
    <CredentialStructure>http://www.ngo.org/CredStruct1c.xml</CredentialStructure>
  </References>
  <Attributes>
    <Attribute name="attr1">
      <Value>1313</Value>
    </Attribute>
    <Attribute name="attr2">
      <Value>1314</Value>
    </Attribute>
    <Attribute name="attr3">
      <Value>3650481942402582375958668357344705576112980177137059879763127269205158951849</Value>
    </Attribute>
    <Attribute name="attr4">
      <Value>102787220464222280996129743007714452389327536866272886834038024772423502010111</Value>
    </Attribute>
  </Attributes>
  <Signature>
    <A>4577203370457028103328464524009908407678530932702268969604921740432094012057267265391467549098938756160113921075018338429871253984616919712553244267534453860570061726743969128237710056258666612030637074181673648718547405470833959238541335822229329923258603946007812460664815016752977751870583672112219685670</A>
    <e>259344723055062059907025491480697571938277889515152306249728583105665800713306759149981690559193987143066508365305231362110587327836295793570784667053393280624077323010434407507031</e>
    <v>1886712313377576902346742514526196255042662312355169165251575149544895673976790723668240852236092150258573397512218034802547632226657789411045047235570833503074786239001345192071113059146559077737251881861602343246597598194456589149108602164508317919280780656546557145721654584626247702048639106763750468019683560611741773821931085497601700798100259059092621784596870472909399759968010607601519304713480261249645912652372855635295</v>
  </Signature>
  <Features>
    <Updates>
      <UpdateSpecification>http://www.base.of.uri/where/the/updates/will/be/Update_gji0mel50hajioefprj4.xml</UpdateSpecification>
      <capU>39795474969593217416933349962463427292420963711509523012644375556667003367544744347604703363119433727381127286693620204196970892718137808366083096595650221410120190651925997145831053114343242093092131546774973177240317249450118504971328898214680296777428034974303889048742870352654763091521947240404812714441</capU>
      <vPrime>784323090155700429083358475107418501456204408507084599427340724518962109232946679604573793795796227703476037952378296757102089545258163392407723085635724420980131397140169296555394807787367629535017480648768175136189982752076226969716669107564898104126800227594154544021604587532558119604695739584139157256577274345742785085296990</vPrime>
      <nonce>481722685390562291726</nonce>
      <context>57132007859431325469155257180381990227612921134850039113478974728701260469495</context>
    </Updates>
  </Features>
</Credential>