<?xml version="1.0" encoding="UTF-8"?><Credential xmlns="http://www.zurich.ibm.com/security/idemix" xmlns:xs="http://www.w3.org/2001/XMLSchema" xmlns:xsi="http://www.w3.org/2001/XMLSchema-instance" xsi:schemaLocation="http://www.zurich.ibm.com/security/idemix ../xsd/Credential.xsd">
  <References>
    <IssuerPublicKey>http://www.issuer.com/ipk.xml</IssuerPublicKey>
    <CredentialStructure>http://www.ngo.org/CredStruct7.xml</CredentialStructure>
  </References>
  <Attributes>
    <Attribute name="peCivilStatus">
      <Value>19</Value>
      <EnumValue>civilStatus;Common-lawPartner</EnumValue>
    </Attribute>
    <Attribute name="peOfficialLanguage">
      <Value>26381</Value>
      <EnumValue>officialLanguage;Italian</EnumValue>
      <EnumValue>officialLanguage;Rhaeto-Romanic</EnumValue>
      <EnumValue>officialLanguage;German</EnumValue>
    </Attribute>
    <Attribute name="peDriverCategory">
      <Value>129271155</Value>
      <EnumValue>driverCategory;D1E</EnumValue>
      <EnumValue>driverCategory;C1</EnumValue>
      <EnumValue>driverCategory;D1</EnumValue>
      <EnumValue>driverCategory;B</EnumValue>
      <EnumValue>driverCategory;A1</EnumValue>
      <EnumValue>driverCategory;C1E</EnumValue>
      <EnumValue>driverCategory;BE</EnumValue>
    </Attribute>
    <Attribute name="peSex">
      <Value>41</Value>
      <EnumValue>sex;Male</EnumValue>
    </Attribute>
  </Attributes>
  <Signature>
    <A>2898490956978725349674873550602321465739623643733799139219143556475521091833287322991715658132263996022308550938366788709610377628421873363382479508032081926385943314957229482440841971786241077379081233094587901859809659874058456974230381251107425822875825547846510594718687325149999921042776293449762470251</A>
    <e>259344723055062059907025491480697571938277889515152306249728583105665800713306759149981690559193987143073374528172748214790523485995597054708545643961025945876975002493408488709107</e>
    <v>-333518544360929587209902029518028488310063405155252075782012436540640187529503994318530229916467584936667206682463288900553982793703158036424226481994874336362883796663473207103643774151716653803816931134200585826848407883483829773286941343621761577103151977840263453447922664482523275302712148769854616930118897034315065135790424802016117045553576790424030995612270673672700998886797114775858586423064556937566714217500907806572</v>
  </Signature>
  <Features/>
</Credential>